{
  "id": "ai-invoice-chaser",
  "name": "AI invoice chaser",
  "one_liner": "Sends polite, escalating payment reminders on behalf of freelancers and small agencies so they get paid without writing awkward follow-up emails.",
  "target_customer": "Freelancers and 1-15 person agencies who invoice business clients on net terms (often from PDFs, Stripe or an invoicing app) and currently chase late payers by hand or with a basic built-in reminder.",
  "existing_products": [
    {
      "name": "ChaseAI",
      "url": "https://chaseai.app/",
      "pricing": "Starter from $9/month with a 14-day free trial; higher tiers exist but their prices were not visible in any indexed source.",
      "positioning": "AI invoice chaser for freelancers: upload the invoice PDF, AI writes and sends a professional reminder sequence; no accounting-software integration required.",
      "strengths": "Cheapest entry price found, two-minute setup, works from a PDF so it covers freelancers who invoice from Word/Canva/Stripe; publishes its own 'best invoice chasing software' comparison content for SEO.",
      "weaknesses": "No review presence on G2/Capterra/Product Hunt found; no integrations with accounting tools; claims like 'paid 3x faster' are unsubstantiated vendor marketing.",
      "traction_signal": "No user, revenue or review counts found; has an X account (@ChaseAiApp) and an earlier vercel.app prototype, suggesting a recent (2025-2026) solo/indie launch.",
      "type": "direct"
    },
    {
      "name": "RemindFox",
      "url": "https://www.remindfox.net/",
      "pricing": "Free 'Scout' plan (one active chase at a time); 'Silver Fox' $19/month for unlimited simultaneous chases.",
      "positioning": "AI-powered polite payment nudges for freelancers who hate the 'just checking in' email; up to four scheduled reminders with a 3-hour opt-out window before each send; markets itself as a Chaser HQ and Invoice Ninja alternative.",
      "strengths": "Exactly the proposed positioning (polite, escalating, freelancer-first); free tier for trial; comparison pages targeting incumbent brand searches.",
      "weaknesses": "Brand new (added to AlternativeTo 27 May 2026), no reviews found, unclear whether it reads client replies or just fires a fixed schedule.",
      "traction_signal": "Listed on AlternativeTo May 2026 and in G2's discussion index; no review counts or user numbers found.",
      "type": "direct"
    },
    {
      "name": "Paidly (Always Paid)",
      "url": "https://alternativeto.net/software/paidly--always-paid/about",
      "pricing": "Free limited plan; paid plans between $12 and $52/month.",
      "positioning": "Utility SaaS for freelancers and agencies that ingests invoices by email forward, PDF upload or API, sends escalating reminders in a chosen tone, and auto-marks invoices paid when payment confirmation emails are forwarded.",
      "strengths": "No accounting-software dependency; tone and escalation customisation; AI matching of payment confirmations.",
      "weaknesses": "Own site not indexed in results, only third-party directory listings; no reviews found; unclear if still actively developed.",
      "traction_signal": "None found beyond directory listings.",
      "type": "direct"
    },
    {
      "name": "Paidnice",
      "url": "https://www.paidnice.com/",
      "pricing": "Essentials $39/month (100 invoices actioned), Pro $69/month (250 invoices actioned); SMS charged per message (USD $0.10, GBP £0.05); free trial.",
      "positioning": "AR automation for small and mid-sized businesses on Xero and QuickBooks Online: reminders, statements, automated late fees and interest, payment plans, escalation.",
      "strengths": "Winner of Xero Global Small Business App of the Year 2025 and finalist in four 2026 categories; 5.0 average across 81 Xero App Store reviews (June 2026); claims 25% average DSO reduction; widest enforcement feature set at the lowest flat SMB price.",
      "weaknesses": "Requires Xero or QuickBooks, so pure-PDF/Stripe freelancers are excluded; $39 floor is high for a solo freelancer with a handful of invoices; email-template rather than conversational AI.",
      "traction_signal": "'Hundreds of business owners' per its own site; 81 five-star Xero App Store reviews; award wins in 2025 and 2026.",
      "type": "direct"
    },
    {
      "name": "Chaser",
      "url": "https://www.chaserhq.com/",
      "pricing": "Compact plan £199/month (UK) or $259/month (US) for companies under £4M turnover; jumps to £599/month above that; annual or monthly billing.",
      "positioning": "The category-defining UK credit-control platform for finance teams: automated reminders, debtor monitoring, payment portal, escalation to a debt-recovery service.",
      "strengths": "Founded 2013, ~30 staff, est. $3.3M ARR (Latka estimate), $4-6M raised; claims $7B+ collected; 4.4 on G2; deep Xero/QBO/Sage integrations.",
      "weaknesses": "2026 price rise pushed the floor to £199/month, which competitor blogs (Paidnice, Trove, Equisettle) explicitly exploit; reviewers cite weak reporting and inability to reply directly to client responses inside the tool.",
      "traction_signal": "Est. $3.3M ARR and $9.9M valuation (getlatka.com); shortlisted for three Credit Strategy Awards 2025.",
      "type": "indirect"
    },
    {
      "name": "FreshBooks (Plus tier)",
      "url": "https://www.freshbooks.com/pricing",
      "pricing": "Lite $23/month (no automated reminders), Plus $43/month (automated reminders and scheduled late fees), Premium $70/month; 30-day trial.",
      "positioning": "All-in-one freelancer accounting where automated late-payment reminders and late fees are a paid-tier feature bundled with invoicing.",
      "strengths": "Reminders fire from the same system that issued the invoice, so no data entry; large existing freelancer base; late fees auto-added to the next reminder.",
      "weaknesses": "Reminders are gated behind the $43 tier; fixed templates rather than AI-written or reply-aware; single-user pricing with $11/seat add-ons.",
      "traction_signal": "Long-established category leader for freelancer invoicing (reviewed by NerdWallet, Agiled, Jobbers 2026 lists).",
      "type": "indirect"
    },
    {
      "name": "QuickBooks Online with Intuit Assist / Payments Agent",
      "url": "https://quickbooks.intuit.com/r/innovation/intuit-assist-for-quickbooks/",
      "pricing": "Included in QuickBooks Online subscriptions (from roughly $35/month); no separate charge for the AI agents.",
      "positioning": "Since 1 July 2025 QuickBooks ships a 'Payments Agent' that tracks invoices, analyses customer payment behaviour, drafts AI reminders and suggests late fees; Intuit claims automated reminders get businesses paid 45% faster (about 5 days sooner).",
      "strengths": "Zero-friction for the millions of QBO users; AI-generated wording is already there; bundled free with the accounting plan.",
      "weaknesses": "Only covers invoices raised inside QuickBooks; agents are US-first and still maturing; SMB QBO users are not the freelancer-with-PDF segment.",
      "traction_signal": "Intuit press release and Accounting Today coverage of the July 2025 launch; QuickBooks is the largest SMB accounting platform in the US.",
      "type": "indirect"
    },
    {
      "name": "Zoho Invoice / Wave (free invoicing with reminders)",
      "url": "https://www.zoho.com/invoice/pricing/",
      "pricing": "Zoho Invoice: free forever (500-1,000 invoices/year, 2 users) including automated payment reminders; Wave: free invoicing with automated reminders, late fees added manually.",
      "positioning": "Free invoicing suites that include scheduled reminders as a checkbox feature.",
      "strengths": "Free, widely recommended in every 2026 freelancer invoicing listicle, reminders trigger from the invoice record.",
      "weaknesses": "Template-only, fixed schedules, no tone escalation or reply handling; 'Powered by Zoho' branding on free tier.",
      "traction_signal": "Zoho and Wave are among the most-cited freelancer invoicing tools across NerdWallet, Agiled and Jobbers 2026 rankings.",
      "type": "substitute"
    },
    {
      "name": "Manual chasing, Google Sheets scripts, or a virtual assistant",
      "url": "https://www.upwork.com/hire/accounts-receivable-managers/",
      "pricing": "Gumroad 'Invoice Reminder Pro' Google Sheets automations sell for one-off fees; Upwork accounts-receivable freelancers charge $22-42/hour; most freelancers simply write the email themselves.",
      "positioning": "The default workaround: hand-written follow-ups, a spreadsheet with a script that emails overdue rows daily, or paying a bookkeeper/VA to chase.",
      "strengths": "Free or cheap, fully under the freelancer's control, no new tool to learn.",
      "weaknesses": "Awkward, inconsistent, easy to forget; agencies report 3-10+ hours per month chasing (Ignition 2025).",
      "traction_signal": "Multiple Gumroad sheet-automation products and 88 GitHub repositories matching 'invoice reminder freelancer' show people building their own.",
      "type": "substitute"
    }
  ],
  "demand_signals": [
    "Ignition's April 2025 survey of 273 US agency leaders (mostly 1-50 staff): 97% regularly deal with late client payments, 71% say at least one in four invoices is late, 84% spend 3-10+ hours a month chasing.",
    "Intuit QuickBooks 2025 Small Business Late Payments Report (2,487 US businesses <100 employees, January 2025): 56% are owed money on unpaid invoices, average $17,500 outstanding, nearly 3 in 10 owners have delayed paying themselves.",
    "Remote's 2025 Contractor Management Report: 85% of freelancers are paid late at least sometimes and 21% are paid late or not at all more than half the time; IPSE 2025 UK survey: 71% of freelancers have experienced late payment, average overdue invoice sits 23 days past due.",